{
  "schema_version": "obs.symptom_context.v1",
  "context_id": "symptom-context-R-TEST",
  "scope": "run",
  "run_id": "R-TEST",
  "symptom": {},
  "target_summary": {
    "target_ids": ["local"],
    "captured_count": 1,
    "failed_count": 0,
    "data_quality": {
      "dropped": false,
      "drop_count": 0,
      "throttled": false,
      "missing": [],
      "truncated": false,
      "clock_confidence": "medium",
      "notes": []
    }
  },
  "agent_context": {},
  "investigation_route": {},
  "compiled_route": {},
  "facts": [],
  "missing_fact_ids": [],
  "recommended_refs": [],
  "next_safe_probes": [],
  "hypothesis_set": {
    "schema_version": "obs.hypothesis_set.v1",
    "scope": "run",
    "run_id": "R-TEST",
    "hypotheses": [],
    "data_quality": {
      "dropped": false,
      "drop_count": 0,
      "throttled": false,
      "missing": [],
      "truncated": false,
      "clock_confidence": "medium",
      "notes": []
    }
  },
  "evidence_graph": {
    "schema_version": "obs.evidence_graph.v1",
    "scope": "run",
    "run_id": "R-TEST",
    "nodes": [],
    "edges": [],
    "data_quality": {
      "dropped": false,
      "drop_count": 0,
      "throttled": false,
      "missing": [],
      "truncated": false,
      "clock_confidence": "medium",
      "notes": []
    }
  },
  "probe_plan": {
    "schema_version": "obs.probe_plan.v1",
    "probe_plan_id": "PP-TEST",
    "scope": "run",
    "run_id": "R-TEST",
    "goal": "Reduce uncertainty without making a cause claim.",
    "candidate_probes": [],
    "data_quality": {
      "dropped": false,
      "drop_count": 0,
      "throttled": false,
      "missing": [],
      "truncated": false,
      "clock_confidence": "medium",
      "notes": []
    }
  },
  "safety_policy": {
    "schema_version": "obs.safety_policy.v1",
    "policy_id": "default-rootless-lab-policy",
    "default_decision": "deny",
    "rules": [],
    "data_quality": {
      "dropped": false,
      "drop_count": 0,
      "throttled": false,
      "missing": [],
      "truncated": false,
      "clock_confidence": "medium",
      "notes": []
    }
  },
  "budget": {
    "max_context_bytes": 65536,
    "returned_bytes": 100,
    "fact_count": 0,
    "missing_fact_count": 0,
    "selected_pack_count": 0,
    "truncated": false
  },
  "raw_refs": {},
  "data_quality": {
    "dropped": false,
    "drop_count": 0,
    "throttled": false,
    "missing": [],
    "truncated": false,
    "clock_confidence": "medium",
    "notes": []
  }
}
